{
  "source": "kalshi",
  "event_id": "KXSEOULMAYOR-26JUN03",
  "event_slug": "kxseoulmayor-26jun03",
  "captured_at": "2026-05-11T04:07:32.391Z",
  "interval": "1d",
  "candidates": [
    {
      "name": "Chong Won-o",
      "name_ko": "정원오",
      "party_id": "dpk",
      "market_id": "KXSEOULMAYOR-26JUN03-CWON",
      "series": [
        {
          "t": "2025-12-17T05:00:00Z",
          "p": 0.43
        },
        {
          "t": "2025-12-18T05:00:00Z",
          "p": 0.47
        },
        {
          "t": "2025-12-19T05:00:00Z",
          "p": 0.47
        },
        {
          "t": "2025-12-20T05:00:00Z",
          "p": 0.47
        },
        {
          "t": "2025-12-21T05:00:00Z",
          "p": 0.48
        },
        {
          "t": "2025-12-22T05:00:00Z",
          "p": 0.48
        },
        {
          "t": "2025-12-23T05:00:00Z",
          "p": 0.48
        },
        {
          "t": "2025-12-24T05:00:00Z",
          "p": 0.48
        },
        {
          "t": "2025-12-25T05:00:00Z",
          "p": 0.48
        },
        {
          "t": "2025-12-26T05:00:00Z",
          "p": 0.48
        },
        {
          "t": "2025-12-27T05:00:00Z",
          "p": 0.48
        },
        {
          "t": "2025-12-28T05:00:00Z",
          "p": 0.5
        },
        {
          "t": "2025-12-29T05:00:00Z",
          "p": 0.51
        },
        {
          "t": "2025-12-30T05:00:00Z",
          "p": 0.65
        },
        {
          "t": "2025-12-31T05:00:00Z",
          "p": 0.65
        },
        {
          "t": "2026-01-01T05:00:00Z",
          "p": 0.57
        },
        {
          "t": "2026-01-02T05:00:00Z",
          "p": 0.57
        },
        {
          "t": "2026-01-03T05:00:00Z",
          "p": 0.75
        },
        {
          "t": "2026-01-04T05:00:00Z",
          "p": 0.57
        },
        {
          "t": "2026-01-05T05:00:00Z",
          "p": 0.57
        },
        {
          "t": "2026-01-06T05:00:00Z",
          "p": 0.57
        },
        {
          "t": "2026-01-07T05:00:00Z",
          "p": 0.66
        },
        {
          "t": "2026-01-08T05:00:00Z",
          "p": 0.66
        },
        {
          "t": "2026-01-09T05:00:00Z",
          "p": 0.66
        },
        {
          "t": "2026-01-10T05:00:00Z",
          "p": 0.66
        },
        {
          "t": "2026-01-11T05:00:00Z",
          "p": 0.6
        },
        {
          "t": "2026-01-12T05:00:00Z",
          "p": 0.59
        },
        {
          "t": "2026-01-13T05:00:00Z",
          "p": 0.52
        },
        {
          "t": "2026-01-14T05:00:00Z",
          "p": 0.56
        },
        {
          "t": "2026-01-15T05:00:00Z",
          "p": 0.56
        },
        {
          "t": "2026-01-16T05:00:00Z",
          "p": 0.56
        },
        {
          "t": "2026-01-17T05:00:00Z",
          "p": 0.56
        },
        {
          "t": "2026-01-18T05:00:00Z",
          "p": 0.56
        },
        {
          "t": "2026-01-19T05:00:00Z",
          "p": 0.59
        },
        {
          "t": "2026-01-20T05:00:00Z",
          "p": 0.59
        },
        {
          "t": "2026-01-21T05:00:00Z",
          "p": 0.59
        },
        {
          "t": "2026-01-22T05:00:00Z",
          "p": 0.59
        },
        {
          "t": "2026-01-23T05:00:00Z",
          "p": 0.59
        },
        {
          "t": "2026-01-24T05:00:00Z",
          "p": 0.63
        },
        {
          "t": "2026-01-25T05:00:00Z",
          "p": 0.63
        },
        {
          "t": "2026-01-26T05:00:00Z",
          "p": 0.57
        },
        {
          "t": "2026-01-27T05:00:00Z",
          "p": 0.57
        },
        {
          "t": "2026-01-28T05:00:00Z",
          "p": 0.57
        },
        {
          "t": "2026-01-29T05:00:00Z",
          "p": 0.57
        },
        {
          "t": "2026-01-30T05:00:00Z",
          "p": 0.64
        },
        {
          "t": "2026-01-31T05:00:00Z",
          "p": 0.57
        },
        {
          "t": "2026-02-01T05:00:00Z",
          "p": 0.62
        },
        {
          "t": "2026-02-02T05:00:00Z",
          "p": 0.62
        },
        {
          "t": "2026-02-03T05:00:00Z",
          "p": 0.62
        },
        {
          "t": "2026-02-04T05:00:00Z",
          "p": 0.62
        },
        {
          "t": "2026-02-05T05:00:00Z",
          "p": 0.62
        },
        {
          "t": "2026-02-06T05:00:00Z",
          "p": 0.62
        },
        {
          "t": "2026-02-07T05:00:00Z",
          "p": 0.62
        },
        {
          "t": "2026-02-08T05:00:00Z",
          "p": 0.62
        },
        {
          "t": "2026-02-09T05:00:00Z",
          "p": 0.62
        },
        {
          "t": "2026-02-10T05:00:00Z",
          "p": 0.62
        },
        {
          "t": "2026-02-13T05:00:00Z",
          "p": 0.62
        },
        {
          "t": "2026-02-14T05:00:00Z",
          "p": 0.74
        },
        {
          "t": "2026-02-15T05:00:00Z",
          "p": 0.73
        },
        {
          "t": "2026-02-16T05:00:00Z",
          "p": 0.74
        },
        {
          "t": "2026-02-17T05:00:00Z",
          "p": 0.74
        },
        {
          "t": "2026-02-18T05:00:00Z",
          "p": 0.74
        },
        {
          "t": "2026-02-19T05:00:00Z",
          "p": 0.74
        },
        {
          "t": "2026-02-20T05:00:00Z",
          "p": 0.78
        },
        {
          "t": "2026-02-21T05:00:00Z",
          "p": 0.79
        },
        {
          "t": "2026-02-22T05:00:00Z",
          "p": 0.81
        },
        {
          "t": "2026-02-23T05:00:00Z",
          "p": 0.79
        },
        {
          "t": "2026-02-24T05:00:00Z",
          "p": 0.77
        },
        {
          "t": "2026-02-25T05:00:00Z",
          "p": 0.81
        },
        {
          "t": "2026-02-26T05:00:00Z",
          "p": 0.81
        },
        {
          "t": "2026-02-27T05:00:00Z",
          "p": 0.8
        },
        {
          "t": "2026-02-28T05:00:00Z",
          "p": 0.82
        },
        {
          "t": "2026-03-01T05:00:00Z",
          "p": 0.82
        },
        {
          "t": "2026-03-02T05:00:00Z",
          "p": 0.8
        },
        {
          "t": "2026-03-03T05:00:00Z",
          "p": 0.81
        },
        {
          "t": "2026-03-04T05:00:00Z",
          "p": 0.77
        },
        {
          "t": "2026-03-05T05:00:00Z",
          "p": 0.78
        },
        {
          "t": "2026-03-06T05:00:00Z",
          "p": 0.78
        },
        {
          "t": "2026-03-07T05:00:00Z",
          "p": 0.78
        },
        {
          "t": "2026-03-08T05:00:00Z",
          "p": 0.78
        },
        {
          "t": "2026-03-09T05:00:00Z",
          "p": 0.84
        },
        {
          "t": "2026-03-10T04:00:00Z",
          "p": 0.85
        },
        {
          "t": "2026-03-11T04:00:00Z",
          "p": 0.87
        },
        {
          "t": "2026-03-12T04:00:00Z",
          "p": 0.87
        },
        {
          "t": "2026-03-13T04:00:00Z",
          "p": 0.88
        },
        {
          "t": "2026-03-14T04:00:00Z",
          "p": 0.87
        },
        {
          "t": "2026-03-15T04:00:00Z",
          "p": 0.85
        },
        {
          "t": "2026-03-16T04:00:00Z",
          "p": 0.86
        },
        {
          "t": "2026-03-17T04:00:00Z",
          "p": 0.88
        },
        {
          "t": "2026-03-18T04:00:00Z",
          "p": 0.92
        },
        {
          "t": "2026-03-19T04:00:00Z",
          "p": 0.85
        },
        {
          "t": "2026-03-20T04:00:00Z",
          "p": 0.84
        },
        {
          "t": "2026-03-21T04:00:00Z",
          "p": 0.84
        },
        {
          "t": "2026-03-22T04:00:00Z",
          "p": 0.83
        },
        {
          "t": "2026-03-23T04:00:00Z",
          "p": 0.84
        },
        {
          "t": "2026-03-24T04:00:00Z",
          "p": 0.83
        },
        {
          "t": "2026-03-25T04:00:00Z",
          "p": 0.81
        },
        {
          "t": "2026-03-26T04:00:00Z",
          "p": 0.81
        },
        {
          "t": "2026-03-27T04:00:00Z",
          "p": 0.81
        },
        {
          "t": "2026-03-28T04:00:00Z",
          "p": 0.81
        },
        {
          "t": "2026-03-29T04:00:00Z",
          "p": 0.81
        },
        {
          "t": "2026-03-30T04:00:00Z",
          "p": 0.81
        },
        {
          "t": "2026-03-31T04:00:00Z",
          "p": 0.82
        },
        {
          "t": "2026-04-01T04:00:00Z",
          "p": 0.5
        },
        {
          "t": "2026-04-02T04:00:00Z",
          "p": 0.77
        },
        {
          "t": "2026-04-03T04:00:00Z",
          "p": 0.81
        },
        {
          "t": "2026-04-04T04:00:00Z",
          "p": 0.81
        },
        {
          "t": "2026-04-05T04:00:00Z",
          "p": 0.82
        },
        {
          "t": "2026-04-06T04:00:00Z",
          "p": 0.82
        },
        {
          "t": "2026-04-07T04:00:00Z",
          "p": 0.82
        },
        {
          "t": "2026-04-08T04:00:00Z",
          "p": 0.82
        },
        {
          "t": "2026-04-09T04:00:00Z",
          "p": 0.82
        },
        {
          "t": "2026-04-10T04:00:00Z",
          "p": 0.83
        },
        {
          "t": "2026-04-11T04:00:00Z",
          "p": 0.88
        },
        {
          "t": "2026-04-12T04:00:00Z",
          "p": 0.88
        },
        {
          "t": "2026-04-13T04:00:00Z",
          "p": 0.88
        },
        {
          "t": "2026-04-14T04:00:00Z",
          "p": 0.88
        },
        {
          "t": "2026-04-15T04:00:00Z",
          "p": 0.88
        },
        {
          "t": "2026-04-16T04:00:00Z",
          "p": 0.89
        },
        {
          "t": "2026-04-17T04:00:00Z",
          "p": 0.88
        },
        {
          "t": "2026-04-18T04:00:00Z",
          "p": 0.89